# name: test/sql/delete/basic_delete.test
# description: Test ducklake deletes
# group: [delete]
# adapted: removed transaction wrapper (hybrid adapter reads committed state only),
#          removed time travel query

require ducklake

require parquet

test-env DUCKLAKE_CONNECTION __TEST_DIR__/{UUID}.db

test-env DATA_PATH __TEST_DIR__


statement ok
ATTACH 'ducklake:${DUCKLAKE_CONNECTION}' AS ducklake (DATA_PATH '${DATA_PATH}/ducklake_delete_files')

statement ok
CREATE TABLE ducklake.test AS SELECT i id FROM range(1000) t(i);

statement ok
INSERT INTO ducklake.test SELECT i id FROM range(15000, 16000) t(i)

query I
SELECT COUNT(*) FROM ducklake.test
----
2000

statement ok
DELETE FROM ducklake.test WHERE id%2=0

query II
SELECT COUNT(*), COUNT(*) FILTER(WHERE id%2=0) FROM ducklake.test
----
1000	0
