# name: test/sql/delete/delete_same_transaction.test
# description: Test ducklake multiple deletes
# group: [delete]
# adapted: removed transaction wrapper (hybrid adapter reads committed state only),
#          removed glob() verification

require ducklake

require parquet

test-env DUCKLAKE_CONNECTION __TEST_DIR__/{UUID}.db

test-env DATA_PATH __TEST_DIR__


statement ok
ATTACH 'ducklake:${DUCKLAKE_CONNECTION}' AS ducklake (DATA_PATH '${DATA_PATH}/ducklake_delete_same_transaction_files')

statement ok
CREATE TABLE ducklake.test AS SELECT i id FROM range(1000) t(i);

statement ok
DELETE FROM ducklake.test WHERE id%2=0

query I
SELECT COUNT(*) FROM ducklake.test WHERE id<=250
----
125

statement ok
DELETE FROM ducklake.test WHERE id<=250

query I
SELECT COUNT(*) FROM ducklake.test WHERE id<=250
----
0

query II
SELECT COUNT(*), COUNT(*) FILTER(WHERE id%2=0) FROM ducklake.test
----
375	0
